key,en,cn,jp,ko,zh,情緒,vi
SCENE_KONIAL_FULL_NELSON_PLAYING_04,You... remember this...! Ah... ahiuh...!,你……给我记住……！啊……啊咿呜……！,お前…覚えておけよ…！あっ…あひぅっ…！,네 녀석.. 두고 봐..! 아.. 아앙!,你……給我記住……！啊……啊咿嗚……！,びっくり,Ngươi... hãy nhớ mặt ta đấy...! A... á...!
SCENE_REINA_MISSIONARY_ONSEN_CUM_02,...Please don't stop... inside... come all inside me...!,……请不要停……里面……全部射在里面……！,…やめないでください…中に…中に全部…出してください…っ！,..멈추지 마세요.. 안에.. 안에 전부 싸주세요..!,……請不要停……裡面……全部射在裡面……！,絶頂,...Đừng dừng lại anh ơi... vào trong... hãy bắn hết vào trong em đi...!
SCENE_REINA_MISSIONARY_ONSEN_CUM_01,I-I'm coming...! Hot semen... deep in my belly... fill me...! Haaahn...!,我、我要去了……！滚烫的精液……射满我的肚子里……！哈啊啊……！,イ、イっちゃいます…！熱い精液…お腹の中に…いっぱい…！はぁぁんっ…！,가.. 가버려요..! 뜨거운 정액.. 뱃속에 가득..! 아앙!,我、我要去了……！滾燙的精液……射滿我的肚子裡……！哈啊啊……！,絶頂,E-em ra mất thôi...! Tinh dịch nóng bỏng... bắn đầy vào bụng em đi...! A...!
SCENE_MAI_FULL_DOGGY_PLAYING_01,Nnoh...! Ahn...! I-it's in... hoo...,嗯喔……！啊嗯……！进、进来了……呼……,んおっ…！あんっ…！き、来たぁ…ふぅっ…,으옷..! 아앙! 왔어어~ 흐응..,嗯喔……！啊嗯……！進、進來了……呼……,びっくり,Ư... á...! V-vào rồi... phù...
SCENE_MAI_FULL_DOGGY_PLAYING_02,Feeling you fill me up is seriously the best...! Nn! This angle's good...!,被你塞得满满的感觉真的超爽……！嗯！这个角度不错耶……！,パンパンに入ってる感じ、マジ最高…！んっ！この角度…イイじゃん…！,꽉 차는 느낌 최고야~! 흣! 이 각도 좋아..!,被你塞得滿滿的感覺真的超爽……！嗯！這個角度不錯耶……！,びっくり,"Cảm giác được lấp đầy khít khao thế này, sướng dã man...! Ưm! Góc này... tuyệt đấy chứ...!"
SCENE_MAI_FULL_DOGGY_PLAYING_03,"Nnnh! There...! Hah, aahn... ahn...!",嗯嗯！那里……！哈啊、啊啊……啊嗯……！,んんっ！そこぉっ…！はぁっ、ああん…あんっ…！,"으응! 거기잇~! 하앗, 아앙~ 앙!",嗯嗯！那裡……！哈啊、啊啊……啊嗯……！,びっくり,"Ưm! Chỗ đó đó...! Hà, á... ư...!"
SCENE_MAI_FULL_DOGGY_PLAYING_04,More cock...! Thrust into me harder...! More! Naaah...!,再来……！更用力地插我……！再来！嗯啊啊……！,ちんぽ、もっと…！もっとガンガン突いてよぉ…！もっと！んぁあっ…！,"자지, 더! 더 박아줘어! 더! 아아앗!",再來……！更用力地插我……！再來！嗯啊啊……！,びっくり,Nữa đi cậu...! Ra sức đâm mạnh bạo nữa đi...! Nữa đi! Á...!
SCENE_PAZUZU_AHEN_KISS_2,Mmm... *wet kiss*...,啾……啾噗……,ちゅ…ちゅぷ…,츄.. 릅..,啾……啾噗……,キス,Chụt... chụt...
SCENE_MAI_AHEN_FELLATIO_5,Mmm...,啾……,ちゅっ…,츄..,啾……,キス,Chụt...
SCENE_PAZUZU_AHEN_KISS_1,Mgh...!,嗯咕……！,むぐっ…！,읍..!,嗯咕……！,キス,Ưm...!
SCENE_BUTLER_AHEN_KISS_5,...Nn...,……嗯……,…ん…,..응..,……嗯……,キス,...Ưm...
SCENE_BUTLER_AHEN_8,Hah...,哈呜……,はぅ…,하으..,哈嗚……,キス,Ư...
SCENE_REINA_FELLATIO_AFTER_01,Gulp... hah... so this is... what your semen tastes like...,吞……哈啊……原来您的精液……是这种味道……,んぐっ…はぁ…あなたの精液…こんな味だったんですね…,(꿀꺽..) 하아.. 당신의 정액.. 이런 맛이었군요..,吞……哈啊……原來您的精液……是這種味道……,照れてる+飲み込んだ,Ực... hà... tinh dịch của anh... thì ra lại có vị như thế này sao...
SCENE_REINA_FELLATIO_AFTER_02,Just now... did I make a terribly lewd face...? ...I-I'm embarrassed...,刚才……我的表情是不是很色情……？ ……好、好害羞……,さっき…私…すごくいやらしい顔してましたか…？…は、恥ずかしいです…,방금.. 저.. 엄청 야한 얼굴이었나요? 부끄러워요..,剛才……我的表情是不是很色情……？……好、好害羞……,照れてる,Vừa nãy... trông mặt em... có dâm đãng lắm không anh...? ...E-em xấu hổ quá...
SCENE_REINA_FELLATIO_AFTER_03,Hehe... it feels as though I caught every last drop... I'm so happy...,呵呵……感觉好像把您的全部都接住了……我很开心……,ふふっ…あなたのもの、全部受け止めてあげられた気分です…嬉しいですね…,후훗.. 당신의 것을 남김없이 받은 기분이에요.. 기쁘네요.,呵呵……感覺好像把您的全部都接住了……我很開心……,笑顔,Hư hư... em thấy như mình đã nhận lấy hết mọi thứ của anh vậy... hạnh phúc thật đấy...
SCENE_REINA_HANDJOB_CUM_01,Ah... are you... about to cum...? Nnnh...!,啊……您是不是……快射了……？嗯嗯……！,あっ…もう…出そうですか…？んんっ…！,앗.. 곧.. 나올 거 같으세요? 하읏..!,啊……您是不是……快射了……？嗯嗯……！,びっくり,A... sắp... bắn rồi sao anh...? Ưm...!
SCENE_REINA_DOGGY_READY_03,Please move... slowly... I'm still... nervous...,请您……慢慢动……我还……有点紧张……,ゆっくり…動いてください…まだ…緊張してて…,천천히.. 움직여 주세요.. 아직은.. 놀라서..,請您……慢慢動……我還……有點緊張……,緊張,Anh hãy... chuyển động nhè nhẹ thôi nhé... em vẫn còn... căng thẳng lắm...
SCENE_REINA_DOGGY_READY_02,"It's all the way... deep inside me... ah, it's so hot...",全部都……进到最里面了……啊，好烫……,奥まで…全部入ってきました…あ、熱い…です…,안쪽까지.. 전부 들어왔어요.. 뜨거워요..,全部都……進到最裡面了……啊，好燙……,緊張,Vào sâu... tận cùng trong em rồi... nóng... nóng quá anh ơi...
SCENE_REINA_DOGGY_READY_01,"Ah... it hurts a little, but... I'm okay...",啊……有点痛……可是没关系……,あ…ちょっと痛いですけど…大丈夫です…,아.. 아프지만.. 괜찮아요..,啊……有點痛……可是沒關係……,緊張,Á... hơi đau một chút nhưng... không sao đâu ạ...
SCENE_PAZUZU_TENTACLE_RAPE_READY_02,Wh-what are you... planning to do...?,你、你打算……做什么……？,な、何を…するつもりですか…,"뭐, 뭘 하려는 건가요..",你、你打算……做什麼……？,緊張,Ng-ngươi định... làm gì ta thế hả...
SCENE_REINA_HANDJOB_CUM_02,It's okay... cover me... cover me all over... Aaah...!,没关系……请射好多……在我身上……啊啊……！,大丈夫です…いっぱい…かけてください…あぁっ…！,괜찮아요.. 잔뜩.. 뿌려주세요.. 아..!,沒關係……請射好多……在我身上……啊啊……！,絶頂,Không sao đâu anh... hãy bắn... bắn ngập người em đi... á...!
SCENE_PAZUZU_TENTACLE_RAPE_READY_03,This joke has gone too far...!,这种玩笑太过分了……！,冗談が過ぎますよ…！,장난이 지나쳐요..!,這種玩笑太過分了……！,緊張,Trò đùa này quá trớn rồi đấy...!
SCENE_PAZUZU_TENTACLE_RAPE_READY_01,S-so... something that big...,好、好……好大的东西……,す、すごく…大きいのが…,어.. 엄청나게 큰 게..,好、好……好大的東西……,緊張,C-cái thứ... to lớn thế này...
SCENE_MAI_DOGGY_DOOR_CUM_02,Ah... you want to come? Your thrusts just got crazy fast...!,啊……你想射了？你的抽插变得超快的……！,あ…出したいんだ…？ピストン、めっちゃ速くなってる…っ！,아.. 싸고 싶은 거야..? 피스톤 엄청 빨라졌..!,啊……你想射了？你的抽插變得超快的……！,絶頂,Cậu... muốn ra rồi sao...? Nhịp thúc... bắt đầu nhanh kinh khủng rồi kìa...!
SCENE_MAI_DOGGY_DOOR_CUM_01,Huh...? Nn...? A-are you coming...!?,咦……？嗯……？你、你要射了……！ ？,え…？ん…？だ…出すの…！？,어..? 응..? 싸.. 싸는 거야?!,咦……？嗯……？你、你要射了……！？,びっくり,Ủa...? Hử...? Cậu... sắp bắn rồi sao...!?
SCENE_MAI_COWGIRL_SWIMSUIT_PLAYING_04,Auh...! You keep hitting nothing but my weak spots...!,啊呜……！你怎么一直顶我敏感的地方啦……！,あうっ…！弱いとこばっか…しつこく突いてくるじゃん…！,아읏..! 약한 곳을 집요하게.. 찔러오고있어..,啊嗚……！你怎麼一直頂我敏感的地方啦……！,びっくり,Á...! Cứ nhắm vào chỗ nhạy cảm... thúc liên tục thế hả...!
SCENE_MAI_SUMATA_CUM_01,"Nn, about to come? Fine... all over my thighs...",嗯，快射了？可以啊……射满我的大腿吧……,ん、出そうなん？いーよ…あたしの太ももに…いっぱい…,"응, 쌀 거 같아? 괜찮아.. 내 허벅지에.. 잔뜩..",嗯，快射了？可以啊……射滿我的大腿吧……,笑顔,"Ưm, cậu sắp bắn rồi à? Được thôi... cứ xịt đầy... lên đùi tớ đi..."
SCENE_MAI_COWGIRL_SWIMSUIT_PLAYING_03,Hah...! It feels like you're in all the way to the base... aah...!,哈啊……！感觉连根部都进来了……啊啊……！,はぁ…！根元まで入ってきてる感じ…ああんっ…！,하아..! 뿌리 끝까지 들어오는 거 같아.. 아앙..!,哈啊……！感覺連根部都進來了……啊啊……！,びっくり,Hà...! Cảm giác đút sâu lút gốc luôn rồi... á...!
SCENE_MAI_SUMATA_CUM_02,I don't mind. Just let it all out...,我又不介意，全部射出来吧……,あたしは気にしないし、全部出しちゃって…,"난 상관 없으니까, 잔뜩 싸 버려..",我又不介意，全部射出來吧……,笑顔,"Tớ không bận tâm đâu, cứ bắn hết sạch ra đi..."
SCENE_MAI_COWGIRL_SWIMSUIT_PLAYING_02,Nn... my boobs are bouncing like crazy...,嗯……胸部晃得好厉害……,んぅ…おっぱい、めっちゃ揺れてるぅ…,으응.. 가슴 엄청 흔들리고 있어..,嗯……胸部晃得好厲害……,照れてる,Ưm... ngực tớ... nảy tưng tửng luôn này...
SCENE_MAI_COWGIRL_SWIMSUIT_PLAYING_01,Aah...! Hah...! S-so good...!,啊啊……！哈呜……！好、好爽……！,ああん…！はうっ…！い、いぃっ…！,아앙..! 하읏! 좋아..! 츄릅..,啊啊……！哈嗚……！好、好爽……！,びっくり,A...! Á...! S-sướng...!
SCENE_MAI_AHEN_1,Aaahn...!,啊啊……！,あぁんっ…！,아앙..!,啊啊……！,喘ぎ,Á...!
SCENE_PAZUZU_COWGIRL_CUM_02,You've been holding quite a lot... Fill my womb completely...,你似乎积了不少呢……请把我的子宫……填得满满的……,随分溜まってますね…？…子宮、いっぱいに満たしてください……,잔뜩 모았죠..? 자궁 가득 채워야 해요..,你似乎積了不少呢……請把我的子宮……填得滿滿的……,絶頂,Ngươi tích trữ nhiều thế cơ à...? ...Hãy lấp đầy tử cung của ta đi......
SCENE_MAI_AHEN_3,...Huh...!,……呼……！,…ふっ…！,..흣..!,……呼……！,喘ぎ,...Hộc...!
SCENE_MAI_AHEN_2,Hah...!,哈呜……！,はうっ…！,하읏..!,哈嗚……！,喘ぎ,Ưm...!
SCENE_MAI_AHEN_5,Nnn...,嗯嗯……,んんっ…,흐응..,嗯嗯……,喘ぎ,Ưm...
SCENE_PAZUZU_COWGIRL_CUM_01,Ugh...! Are you about to ejaculate...? ...Hin...!,呜……！你快射精了吗……？ ……咿嗯……！,うっ…！射精しそうですか…？…ひんっ…！,웃..! 사정할 거 같나요..? ..으힛..!,嗚……！你快射精了嗎……？……咿嗯……！,絶頂,Ư...! Ngươi sắp bắn rồi sao...? ...Ưm...!
SCENE_BUTLER_AHEN_3,Ah...!,啊……！,あっ…！,아..!,啊……！,喘ぎ,Á...!
SCENE_MAI_AHEN_7,Hyah...!,呀啊……！,ひゃあっ…！,흐앗..!,呀啊……！,喘ぎ,Á...!
SCENE_MAI_AHEN_6,Ugh...!,呜……！,うっ…！,읏..!,嗚……！,喘ぎ,Ư...!
SCENE_MAI_AHEN_9,Ooh...!,喔喔……！,おぉっ…！,오옷..!,喔喔……！,喘ぎ,Ôi...!
SCENE_KONIAL_AHEN_8,Hah...,哈啊……,はぁ…,하아..,哈啊……,喘ぎ,Phù...
SCENE_PAZUZU_TENTACLE_RAPE_CUM_02,Hoo... s-stop...! Aahn...!,呼……住、住手……！啊啊……！,ふぅっ…や、やめて…！ああん…っ！,흐읏.. 그.. 그만..! 아앙..!!,呼……住、住手……！啊啊……！,絶頂,Phù... d-dừng lại đi...! Á...!
SCENE_BUTLER_MISSIONARY_CUM_01,Ah...! Ahn! I-I'm going to lose myself...!,啊……！啊嗯！我、我快变得奇怪了……！,あ……っ！あんっ！お、おかしくなってしまいます……！,"아..! 앙! 이, 이상해요..!",啊……！啊嗯！我、我快變得奇怪了……！,絶頂,A......! Á! Em... em phát điên mất thôi......!
SCENE_PAZUZU_TENTACLE_RAPE_CUM_01,Haaah...! ...Uuh...! I can't... I can't anymore...!,哈啊啊……！ ……呜呜……！已经……已经不行了……！,はぁああっ…！…うぅっ…！もう…もうダメですぅ…！,꺄아앗..! 으읏..! 더는.. 더는 안돼요..!,哈啊啊……！……嗚嗚……！已經……已經不行了……！,絶頂,Hà...! ...Ư...! Không... không chịu nổi nữa rồi...!
SCENE_BUTLER_MISSIONARY_CUM_02,Fua...! Any more and I... will lose myself...!,呼啊……！再这样下去，我……会坏掉的……！,ふあっ…！これ以上は、わたくし…おかしくなって…っ！,흐앗..! 계속하면 저.. 이상해져 버렷..!,呼啊……！再這樣下去，我……會壞掉的……！,絶頂,Phù...! Cứ thế này... em... phát điên lên mất...!
SCENE_PAZUZU_AHEN_3,Ah... aaahn...!,啊……啊啊……！,あっ…あぁん…っ！,아.. 아앙..!,啊……啊啊……！,喘ぎ,A... á...!
SCENE_REINA_AHEN_1,...Ahu...,……啊呼……,…あふっ…,..아흣..,……啊呼……,喘ぎ,...Ưm...
SCENE_PAZUZU_AHEN_2,Hih...,咿……,ひっ…,히끅..,咿……,喘ぎ,Hức...
SCENE_KONIAL_MISSIONARY_KISS_PLAYING_04,"Ah...! I-I'm coming, I'm so close...! Don't stop kissing me...!",啊……！要、要去了，快去了……！不要停下接吻……！,あ…！い、イくっ、イきそう…！キス…やめないでぇ…！,아..! 가.. 가버릴 것 같아..! 키스.. 멈추지 마..!,啊……！要、要去了，快去了……！不要停下接吻……！,キス+照れてる,A...! Ta... ta sắp ra rồi...! Đừng ngừng hôn ta nhé...!
SCENE_PAZUZU_AHEN_1,...Hic...,……呜呃……,…ひぐっ…,..흐윽..,……嗚呃……,喘ぎ,...Hức...
SCENE_REINA_AHEN_3,...Huh...,……呼……,…ふっ…,..흣..,……呼……,喘ぎ,...Phù...
SCENE_REINA_AHEN_2,...Ngh...,……嗯呃……,…んぐっ…,..응읏..,……嗯呃……,喘ぎ,...Ưm...
SCENE_PAZUZU_AHEN_7,...Nnn...,……嗯嗯……,…んんっ…,..응..,……嗯嗯……,喘ぎ,...Ưm...
SCENE_REINA_AHEN_5,Aaah...,啊啊……,ああん…,아앙..,啊啊……,喘ぎ,A...
SCENE_PAZUZU_AHEN_6,...Ugh...,……呜……,…うっ…,..읏..,……嗚……,喘ぎ,...Ư...
SCENE_BUTLER_AHEN_4,Ah...!,啊……！,あ…！,아..!,啊……！,喘ぎ,Á...!
SCENE_PAZUZU_AHEN_5,Kyaa...!,呀啊……！,きゃあっ…！,꺄앗..!,呀啊……！,喘ぎ,Á...!
SCENE_REINA_MISSIONARY_PANTIES_READY_02,I'm wet enough now... I think I can take you all the way...,我已经湿得够多了……应该马上就能接纳您……,もう十分濡れてますから…すぐに受け入れられると思います…,충분히 젖어버렸으니.. 바로 들어올 수 있을 거에요..,我已經濕得夠多了……應該馬上就能接納您……,期待 / 予感,Em đã ướt đẫm lắm rồi... chắc có thể nhận lấy anh ngay lập tức đấy...
SCENE_BUTLER_AHEN_7,Nn...!,嗯……！,んぅ…！,응..!,嗯……！,喘ぎ,Ưm...!
SCENE_KONIAL_MISSIONARY_KISS_PLAYING_01,*Wet kiss*... nn... good... your tongue... my whole mouth... hah...,啾噗……嗯嗯……很好……你的舌头……嘴里全部……哈呜……,ちゅぷ…んん…いいぞ…お前の舌…口の中…全部…はぅっ…,츄웁.. 으응.. 좋아.. 네 혀.. 내 입안.. 전부.. 하읏..,啾噗……嗯嗯……很好……你的舌頭……嘴裡全部……哈嗚……,キス+照れてる,Chụt... ưm... được đấy... lưỡi của ngươi... trong miệng ta... toàn bộ... á...
SCENE_KONIAL_AHEN_4,Hoo...,呼……,ふぅっ…,흐읏..,呼……,喘ぎ,Phù...
SCENE_REINA_MISSIONARY_PANTIES_READY_03,Hah... um... I can't hold back anymore...,哈啊……那个……我已经忍不住了……,はぁ…あの…もう我慢できませんから…,하아.. 저.. 이제 참을 수 없으니까..,哈啊……那個……我已經忍不住了……,期待 / 予感,Hà... anh ơi... em không nhịn nổi nữa rồi...
SCENE_PAZUZU_AHEN_10,Ngh...,嗯……,っ…,읏..,嗯……,喘ぎ,Ư...
SCENE_KONIAL_MISSIONARY_KISS_PLAYING_02,Aah...! While we kiss... hold me tighter...,啊啊……！一边接吻……再用力抱着我……,ああん…！…キスしながら…もっと強く、抱いてくれ…,아앙..! 키스하면서.. 더 세게 안아 줘..,啊啊……！一邊接吻……再用力抱著我……,キス+照れてる,A...! ...Vừa hôn... vừa ôm ta chặt hơn nữa đi...
SCENE_REINA_AHEN_9,Hah...!,哈呜……！,はぅっ…,하읏..,哈嗚……！,喘ぎ,Ưm...
SCENE_KONIAL_MISSIONARY_KISS_PLAYING_03,More... more... ahuh...!,再来……更多……啊呼……！,もっと…もっとぉ…あふぅっ…！,더.. 좀 더.. 아흐읏..,再來……更多……啊呼……！,キス+照れてる,Nữa đi... nữa đi... á...!
SCENE_REINA_MISSIONARY_PANTIES_READY_01,Yes... please put... your cock... inside me...,好的……请把您的……阴茎……放进来……,はい…あなたの…おちんちん…入れてください…,네.. 당신의.. 자지.. 넣어주세요..,好的……請把您的……陰莖……放進來……,緊張,Vâng... con cặc của anh... hãy đút vào trong em đi...
SCENE_MAI_AHEN_8,Hah...,哈啊……,はぁ…,하아..,哈啊……,喘ぎ,Phù...
SCENE_PAZUZU_AHEN_9,...Ah...,……啊……,…あっ…,..아..,……啊……,喘ぎ,...A...
SCENE_PAZUZU_AHEN_8,Hah...,哈啊……,はぁ…,하아..,哈啊……,喘ぎ,Hà...
SCENE_MAI_FELLATIO_READY_01,"Hehe, then... we can really do it, you know?",嘿嘿，那……真的做下去也可以喔？,へへ、じゃあさ、ホントにしちゃってもいーんだよ？,"헤헤, 그럼, 진짜 해도 된다니까?",嘿嘿，那……真的做下去也可以喔？,笑顔,"Hê hê, thế thì tớ làm thật luôn nhé?"
SCENE_MAI_FELLATIO_READY_03,"Oh, bigger than I thought. Can this... even fit all the way?",喔，比我想的还大耶。这个……全部塞得进来吗？,おっ、思ったよりデカいね。これ…全部入るかな？,"오, 생각보다 크네. 입에 다 들어 가려나?",喔，比我想的還大耶。這個……全部塞得進來嗎？,びっくり,"Ôi, to hơn tớ tưởng đấy. Cái này... không biết có đút hết được vào mồm không nữa?"
SCENE_MAI_COWGIRL_FIRST_CUM_01,Aah! Come! Inside... fill me up inside...! All your semen...!,啊啊！射吧！里面……射满里面……！你的精液……全部都给我……！,ああん！出して！中に…中にいっぱい…！あんたの精液…全部ぅ…！,아앙! 싸 줘! 안에.. 안에 가득..! 네 씨앗.. 전부..!,啊啊！射吧！裡面……射滿裡面……！你的精液……全部都給我……！,絶頂,Á! Bắn đi! Vào trong... bắn đầy bên trong đi...! Tinh dịch của cậu... tớ muốn hết...!
SCENE_REINA_DOGGY_WINDOW_PLAYING_03,Thrust into me... harder...! Hah...! Aaah...!,请更激烈地……插进来……！哈啊……！啊啊……！,もっと激しく…突いてください…！はあっ…！…ぁあんっ…！,더 세게 박아주세요..! 하앗..! 아앙!,請更激烈地……插進來……！哈啊……！啊啊……！,びっくり,Anh đâm... mạnh bạo hơn nữa đi...! Hà...! A...!
SCENE_MAI_FELLATIO_READY_02,"Come on, aaah... I opened my mouth. Hurry and put it in.",来，啊～嘴巴张开了。快点放进来啊。,ほら、あ～ん…口開けたし。早く入れてみなよ。,"자, 아~ 입 벌렸어. 어서 넣어 봐.",來，啊～嘴巴張開了。快點放進來啊。,笑顔,"Nào, a~m... Tớ há miệng rồi đấy. Mau đút vào đi xem nào."
SCENE_REINA_DOGGY_WINDOW_PLAYING_02,My breasts... pressed against the window glass... nnnh...! Hah...,胸部……被压在窗户玻璃上……嗯嗯……！哈啊……,おっぱいが…窓ガラスに押し付けられて…んんっ…！はぁ…,가슴이.. 유리창에 눌려서.. 으응..! 하아..,胸部……被壓在窗戶玻璃上……嗯嗯……！哈啊……,びっくり,Ngực em... bị ép sát vào cửa kính... ưm...! Hà...
SCENE_BUTLER_HJ_FELLATIO_READY_01,...Pardon me. Is this... how I should do it?,……失礼了。像这样……就可以了吗？,…失礼いたします。このように…すればよろしいのでしょうか？,..실례하겠습니다. 이렇게.. 하면 될까요?,……失禮了。像這樣……就可以了嗎？,緊張,...Thất lễ rồi ạ. Em... làm như thế này có đúng không ạ?
SCENE_REINA_DOGGY_WINDOW_PLAYING_01,Aah...! Hah...! I-it's so hot...,啊啊……！哈呜……！好、好烫……,ああんっ…！はうっ…！あ、熱いです…,아앙..! 하읏! 뜨.. 뜨거워요..,啊啊……！哈嗚……！好、好燙……,びっくり,A...! Á...! N-nóng quá anh ơi...
SCENE_MAI_COWGIRL_FIRST_CUM_02,I'm coming... gonna come...! Nngh...!,我要去了……要去了……！嗯呃……！,イク…イっちゃうぅっ…！んぐぅ…！,가버려.. 가버려엇..! 으응..!!,我要去了……要去了……！嗯呃……！,絶頂,Ra... tớ ra mất thôi...! Ưm...!
SCENE_BUTLER_HJ_FELLATIO_READY_03,"If it hurts, please tell me...",若是会痛，请您告诉我……,もし痛むようでしたら、おっしゃってください…,혹시 아프시면 말씀해 주세요..,若是會痛，請您告訴我……,緊張,"Nếu ngài thấy đau, xin hãy bảo em nhé..."
SCENE_BUTLER_HJ_FELLATIO_READY_02,It is very... warm... your... cock...,真是……好烫呢……您的……肉棒……,とても…熱うございますね…あなたの…おちんちん…,굉장히.. 뜨겁네요.. 당신의.. 자지..,真是……好燙呢……您的……肉棒……,緊張,Nóng bỏng thật đấy ạ... con cặc của... ngài...
SCENE_REINA_BREAST_TOUCH_READY_01,Y-you really are... touching me... Um... how does it feel?,您、您真的在……摸我……那个……感觉如何呢？,ほ、本当に…触られてる…そ、その…いかが、ですか？,정.. 정말로.. 만지고 있어.. ..어떠신가요?..,您、您真的在……摸我……那個……感覺如何呢？,うろたえる,A-anh... đang sờ thật này... Th-thế... anh thấy thế nào ạ?
SCENE_REINA_SYUYU_READY_01,"Ah... that tickles a little... yes, there...",啊……有点痒……对，就是那里……,あ…少しくすぐったいです…はい、そこ…,"아.. 조금 간지러워요.. ..네, 거기..",啊……有點癢……對，就是那裡……,緊張,"Á... hơi nhột một chút ạ... Vâng, đúng chỗ đó..."
SCENE_REINA_BREAST_TOUCH_READY_02,"Hah... ah, no... please, keep going just like that...",哈啊……啊，不是……请、请继续这样摸我……,はぅっ…あ、いえっ…そ、そのまま…続けてください…,"하읏.. 아, 아니요. 그대로 해 주세요..",哈啊……啊，不是……請、請繼續這樣摸我……,照れてる,"Á... a, không... xin anh cứ... tiếp tục như vậy đi..."
SCENE_REINA_DOGGY_WINDOW_PLAYING_04,It's so embarrassing... I'm going strange... aaah...!,好害羞……我快变得奇怪了……啊啊……！,恥ずかしくて…変になっちゃいます…あぁっ…！,부끄러워서.. 이상해져요.. 아앗..,好害羞……我快變得奇怪了……啊啊……！,照れてる,Xấu hổ quá... em phát điên mất thôi... á...!
SCENE_REINA_SYUYU_READY_02,Hah... my nipples... your tongue is tickling them...,哈呜……乳头……被您的舌头弄得好痒……,はうっ…乳首が…くすぐったいです…舌が…,하읏.. 유두가.. 간지러워요.. 혀가..,哈嗚……乳頭……被您的舌頭弄得好癢……,照れてる,Á... đầu ti em... nhột lắm... cái lưỡi của anh...
SCENE_REINA_BREAST_TOUCH_READY_03,Yes... if it is what you want... as much as you wish...,好的……只要是您希望的……多少都可以……,はい…あなたの…お望みなら…いくらでも…,네.. 당신이.. 원하신다면.. 얼마든지..,好的……只要是您希望的……多少都可以……,照れてる,Vâng... nếu đó là... mong muốn của anh... thì bao nhiêu cũng được...
