key,en,cn,jp,ko,zh,情緒,vi
SCENE_REINA_MISSIONARY_ONSEN_PLAYING_03,That hard thing... is reaching my deepest part... fuaah...!,硬硬的……顶到最里面了……呼啊啊……！,硬いのが…一番奥まで届いてますぅ…ふぁあっ…！,단단한 게.. 끝까지 닿고 있어요.. 흐읏!,硬硬的……頂到最裡面了……呼啊啊……！,照れてる,Cái cứng ngắc của anh... đã chạm đến tận cùng sâu thẳm của em rồi... a...!
SCENE_REINA_MISSIONARY_ONSEN_PLAYING_01,...Aaah...! Deep inside... it's so hot... I feel like I'm melting...,……啊啊……！里面……好热……好像要融化了……,…あぁんっ…！奥が…熱くて…溶けちゃいそうです…,아앙..! 안쪽이.. 뜨거워서.. 녹아버릴 거 같아요..,……啊啊……！裡面……好熱……好像要融化了……,びっくり,...A... á...! Sâu bên trong... nóng quá... em cảm thấy như mình sắp tan chảy ra mất...
SCENE_MAI_SUMATA_AFTER_01,Hah... hah... wow...,哈啊……哈啊……好猛……,はぁ…はぁ…すっご…,하아.. 하아.. 엄청나네..,哈啊……哈啊……好猛……,びっくり,Hà... hà... đỉnh quá...
SCENE_MAI_PAIZURI_READY_03,Even the tip's hidden now. Hehe.,连龟头都藏起来了。嘿嘿。,亀頭まで全部隠れちゃった。へへっ。,귀두까지 전부 숨어 버렸어. 헤헤.,連龜頭都藏起來了。嘿嘿。,遊び心,Lút cả đầu khấc luôn rồi kìa. Hê hê.
SCENE_MAI_PAIZURI_READY_02,Your cock... it's all buried between them. So hot...,你的肉棒……整根都埋进去了。好烫……,あんたのちんぽ…全部入っちゃった。すっごい熱い…,네 자지.. 전부 들어왔어. 엄청 뜨거워..,你的肉棒……整根都埋進去了。好燙……,照れてる,Con cặc của cậu... kẹp trọn hết vào rồi. Nóng quá đi...
SCENE_MAI_SUMATA_AFTER_03,"I'm all sticky with your cum... seriously, like a crazy amount...",都被你的精液弄得黏答答的……量也太多了吧……,あんたの精液でベトベトじゃん…マジですごい量…,네 정액으로 끈적끈적해.. 정말 많이 나왔네.,都被你的精液弄得黏答答的……量也太多了吧……,びっくり,Dính đầy tinh dịch của cậu luôn rồi này... lượng tinh khủng khiếp thật đấy...
SCENE_MAI_PAIZURI_READY_01,Hehe... want me to squeeze you harder?,嘿嘿……要我夹得更用力吗？,へへ…もっと強く挟んであげよっか？,헤헤.. 더 세게 끼워 줄까?,嘿嘿……要我夾得更用力嗎？,笑顔,Hê hê... tớ kẹp mạnh hơn nữa cho cậu nhé?
SCENE_REINA_DOGGY_WINDOW_AFTER_03,...Something like this... isn't bad once in a while...,……偶尔这样……也不坏呢……,…たまには、こういうのも…悪くないですね…,..가끔은 이런 것도.. 나쁘지 않네요..,……偶爾這樣……也不壞呢……,笑顔,...Thỉnh thoảng làm thế này... cũng không tệ đâu anh nhỉ...
SCENE_MAI_SUMATA_AFTER_02,Hehe... how was it? Were my thighs that good?,嘿嘿……怎样？我的大腿有那么爽吗？,へへ…どーだった？あたしの太もも…そんなに良かった？,헤헤.. 어땠어? 내 허벅지.. 그렇게 좋았어?,嘿嘿……怎樣？我的大腿有那麼爽嗎？,笑顔,Hê hê... sao nào? Đùi của tớ... làm cậu sướng đến thế cơ à?
SCENE_REINA_DOGGY_WINDOW_AFTER_02,...Hah... h-how was it? ...Hoo... Did you like it...?,……哈啊……您、您觉得如何呢？ ……呼……喜欢吗……？,…はぁ…い、いかがでしたか？…ふぅ…気に入っていただけましたか…？,..어떠셨나요? ..흐읏. ..마음에 드셨나요?,……哈啊……您、您覺得如何呢？……呼……喜歡嗎……？,余韻,...Hà... a-anh thấy thế nào ạ? ...Phù... anh có thích không...?
SCENE_MAI_DOGGY_BUNNY_PLAYING_04,More... harder...! Do me... until I'm a mess...!,再来……更激烈一点……！把我……弄得乱七八糟……！,もっと…もっと激しくぅ…！…してよ…めちゃくちゃにぃ…っ！,더.. 더 거칠게.. 해줘.. 엉망진창으로.. 옷!,再來……更激烈一點……！把我……弄得亂七八糟……！,照れてる,Nữa đi... mãnh liệt hơn nữa đi...! Làm tớ... điên đảo luôn đi...!
SCENE_KONIAL_PRESS_AFTER_01,Oooh... oh... oho... uuuuh...!,喔喔……喔……喔呵……呜呜……！,おおぉぉ…おっ…おほっ…うぅぅっ…っ！,으고옷.. 오홋.. 으으읏..,喔喔……喔……喔呵……嗚嗚……！,精神/心+おほ声 (壊れた喘ぎ声),Ôi... ôi... ư... ưm...!
SCENE_REINA_DOGGY_WINDOW_AFTER_01,Hah... hah... amazing... my legs... They're shaking...,哈啊……哈啊……好厉害……我的脚……在发抖……,はぁ…はぁ…すごかったです…脚が…震えて…,하아.. 하아.. 대단해요.. 다리가.. 떨려요..,哈啊……哈啊……好厲害……我的腳……在發抖……,余韻,Hà... hà... đỉnh quá anh ơi... chân em... đang run bần bật rồi này...
SCENE_REINA_MISSIONARY_ONSEN_READY_03,In this position... it goes even deeper than usual...,这个姿势的话……会比平常……进得更深呢……,この体勢なら…いつもよりもっと…奥まで入ってきますね…,이 자세라면.. 더 깊이까지 들어올 거에요..,這個姿勢的話……會比平常……進得更深呢……,期待 / 予感,Tư thế này... sẽ đút được sâu vào tận bên trong... hơn mọi khi đấy anh...
SCENE_KONIAL_PRESS_AFTER_02,Ugh... it feels... good...!,呜呃……好……舒服……！,うぐっ…き、気持ち…いいぃ…！,으긋.. 기.. 기분 조하아..,嗚呃……好……舒服……！,精神/心+おほ声 (壊れた喘ぎ声),Ực... s-sướng... sướng quá...!
SCENE_REINA_MISSIONARY_ONSEN_READY_02,Yes... put it... inside me...,嗯……请放进……我里面……,はい…私を…あなたで…いっぱいにしてください…,네.. 제 안에.. 가득 넣어주세요..,嗯……請放進……我裡面……,期待 / 予感,Vâng... anh hãy... lấp đầy em... bằng của anh đi...
SCENE_KONIAL_PRESS_AFTER_03,Hoo... fgh... my womb is full... uuh...,呼……唔咕……子宫被填满了……呜呜……,ふぅっ…ふぐぅ…子宮、いっぱいに…ぅうっ…,흐읏.. 자궁 안에 가득해엣.. 으읏..,呼……唔咕……子宮被填滿了……嗚嗚……,精神/心+おほ声 (壊れた喘ぎ声),"Phù... ực... tử cung ta, bị lấp đầy rồi... ư..."
SCENE_REINA_MISSIONARY_ONSEN_READY_01,Hah... your cock... is already this hot...,哈啊……您的阴茎……已经这么烫了……,はぁ…あなたのおちんちん…もうこんなに熱くなって…,하아.. 당신의 자지.. 벌써 이렇게 뜨거워요..,哈啊……您的陰莖……已經這麼燙了……,期待 / 予感,Hà... con cặc của anh... mới thế đã nóng rực lên rồi...
SCENE_MAI_DOGGY_BUNNY_PLAYING_01,Haaahn...! Nnnh! Thrust into me... harder...!,哈啊啊……！嗯啊！更激烈地……插我……！,はぁあんっ…！んぁっ！激しく…突いてぇ…！,아앙! 앙! 격렬하게.. 박아줘..!,哈啊啊……！嗯啊！更激烈地……插我……！,びっくり,A... ưm! Đâm mạnh... mạnh nữa đi cậu...!
SCENE_KONIAL_ONAHLE_AFTER_02,"Well? Kon-chan made you feel incredible, didn't she?",怎样？小柯让你爽到不行了吧？,どうだった？コンちゃんは、最高に気持ちよかっただろう？,"어땠어? 콘짱, 기분 최고였지?",怎樣？小柯讓你爽到不行了吧？,からかう,Thế nào? Bé Kon làm ngươi sướng đến phát điên đúng không?
SCENE_KONIAL_AHEN_FELLATIO_5,Mmm...,啾……,ちゅっ…,쪼옥..,啾……,フェラキス,Chụt...
SCENE_KONIAL_ONAHLE_AFTER_03,Don't tell me you've already had your fill...,你该不会说这点程度就满足了吧……？,この程度で満足したなんて、言うんじゃないだろうな…？,이 정도로 만족하는 거 아니지?,你該不會說這點程度就滿足了吧……？,からかう,Ngươi đừng bảo là mới cỡ này đã thỏa mãn rồi đấy nhé...?
SCENE_PAZUZU_AHEN_FELLATIO_4,Gulp...,吞……,ごくん…,꿀꺽..,吞……,フェラ,Nuốt...
SCENE_MAI_DOGGY_BUNNY_PLAYING_03,Isn't it... bigger than usual...? Ahuh...!,是不是……比平常还大……？啊呼……！,いつもより…大きくなってんじゃん…？あふっ…！,평소보다 더 커졌잖아..? 아흣!,是不是……比平常還大……？啊呼……！,照れてる,Có vẻ nó... to hơn bình thường thì phải...? Á...!
SCENE_KONIAL_AHEN_FELLATIO_3,Uph...!,唔噗……！,ぅぷっ…！,우웁..!,唔噗……！,フェラ,Ực...!
SCENE_MAI_DOGGY_BUNNY_PLAYING_02,Hah! My womb... deep in my womb... hit it! More...!,哈呜！子宫……子宫深处……顶进来……！好多……！,はうっ！ 子宮…子宮の奥…突いてぇ…！いっぱいぃ…！,하읏! 자궁.. 자궁 찔러서..! 잔뜩..!,哈嗚！子宮……子宮深處……頂進來……！好多……！,びっくり,Ưm! Đâm vào... đâm sâu tận tử cung của tớ đi...! Thật nhiều vào...!
SCENE_KONIAL_ONAHLE_AFTER_01,"Kihihi... it's brimming with semen, spilling right over.",嘻嘻嘻……里面被精液填满，都溢出来了。,きひひっ……ザーメンでいっぱいになったな。溢れてくるぞ。,키히히.. 정액으로 가득해서 넘쳐버렸네.,嘻嘻嘻……裡面被精液填滿，都溢出來了。,どや顔,Kê hê hê... Bắt đầu tràn ngập tinh dịch rồi đấy. Tràn hết ra ngoài kìa.
SCENE_KONIAL_AHEN_FELLATIO_2,Mgh... kiss...,嗯咕……啾……,むぐ…ちゅっ…,우물.. 츄..,嗯咕……啾……,フェラ,Ưm... chụt...
SCENE_MAI_COWGIRL_SWIMSUIT_AFTER_03,"Don't you get tired...? Aha... seriously, you're amazing...",你都不会累吗……？啊哈……真的超厉害耶……,疲れたりしないの…？あは…っ…ほんとスゴいんだけど…,지치지도 않는 거야..? 정말 대단하네..,你都不會累嗎……？啊哈……真的超厲害耶……,余韻+笑顔,Cậu không biết mệt là gì hả...? A ha... thực sự quá đỉnh luôn ấy...
SCENE_REINA_AHEN_FELLATIO_5,Slurp...,啾噜……,ちゅる…,츄릅..,啾嚕……,フェラ,Liếm...
SCENE_MAI_COWGIRL_SWIMSUIT_AFTER_02,Seriously... when did you get this good...?,不是吧……你什么时候变得这么会做了……？,マジで…いつの間にこんな上手くなったわけ…？,정말.. 어느 새 이렇게 잘 하게 된 거야..,不是吧……你什麼時候變得這麼會做了……？,余韻,Nói thật đấy... cậu học lỏm ở đâu mà làm điêu luyện thế từ lúc nào vậy...?
SCENE_MAI_COWGIRL_SWIMSUIT_AFTER_01,"Hah... hah... you came even more than usual, didn't you...?",哈啊……哈啊……你射得比平常还多吧……？,はぁ…はぁ…いつもより、いっぱい出したじゃん…？,하아.. 하아.. 평소보다 많이 쌌잖아..,哈啊……哈啊……你射得比平常還多吧……？,余韻,Hà... hà... cậu bắn ra nhiều hơn mọi khi đấy chứ nhỉ...?
SCENE_MAI_COWGIRL_SWIMSUIT_READY_02,Don't tease me... I'm already this wet...,不要吊我胃口啦……我都湿成这样了……,焦らさないでよぉ…あたし、こんなに濡れてんのに……,애태우지 말고.. 응? 난 이렇게 젖어 있다고..,不要吊我胃口啦……我都濕成這樣了……,期待 / 予感,Đừng trêu tớ nữa mà... tớ đã ướt sũng thế này rồi......
SCENE_MAI_COWGIRL_SWIMSUIT_READY_03,Put that hard cock of yours... all the way in at once...,把你那根……硬梆梆的肉棒……一口气放进来……,あんたの…硬いちんぽ…一気に入れて…,네 단단한 자지.. 단숨에 넣어 줘..,把你那根……硬梆梆的肉棒……一口氣放進來……,照れてる,Hãy đút... con cặc cứng ngắc của cậu... vào hết một lượt đi...
SCENE_MAI_COWGIRL_SWIMSUIT_READY_01,Your cock's been pressing against my ass this whole time...,你的鸡鸡一直顶着我的屁股耶……,あんたのちんぽ、お尻にずっと当たってるし……,"네 자지, 엉덩이에 계속 닿고 있어..",你的雞雞一直頂著我的屁股耶……,照れてる,Con cặc của cậu cứ cạ vào mông tớ suốt nãy giờ kìa......
SCENE_MAI_COWGIRL_SWIMSUIT_CUM_02,Naaah...! Your semen... I'll take every last drop...!,嗯啊啊……！你的精液……我全部都收下……！,んあぁっ…！あんたの精液…全部…もらってあげるぅ…っ！,으응! 네 정액.. 전부.. 받아줄게..!,嗯啊啊……！你的精液……我全部都收下……！,絶頂,Á...! Tinh dịch của cậu... tớ sẽ... nhận hết toàn bộ...!
SCENE_MAI_DOGGY_BUNNY_AFTER_01,Hah... hah... your semen... is dripping out...,哈啊……哈啊……你的精液……流出来了……,はぁ…はぁ…あんたの精液が…垂れてくる…,하아.. 하아.. 네 정액이.. 흘러내려..,哈啊……哈啊……你的精液……流出來了……,余韻,Hà... hà... tinh dịch của cậu... đang chảy ròng ròng ra ngoài rồi...
SCENE_MAI_COWGIRL_SWIMSUIT_CUM_01,As many times as you want...! Empty your balls completely...!,射几次都可以啦……！把你的蛋蛋射到空为止……！,何回でもいーからさ……！キンタマ…空っぽになるまで出しちゃってよ…！,몇 번이고 좋으니까..! 불알 텅 빌 때 까지 싸 줘!,射幾次都可以啦……！把你的蛋蛋射到空為止……！,絶頂,Bao nhiêu lần cũng được tất......! Cứ bắn cho tới khi hai hòn dái sạch trơn luôn đi...!
SCENE_MAI_DOGGY_BUNNY_AFTER_03,...That felt good... Think I can make your cock hard again...?,……好舒服……我能不能让你的鸡鸡……再硬起来呢……？,…気持ちよかった…またちんぽ、カチカチにできるかなぁ…？,..기분 좋아.. 또 자지 단단하게 할 수 있을까..?,……好舒服……我能不能讓你的雞雞……再硬起來呢……？,余韻,...Sướng quá đi... Không biết tớ có làm nó cứng ngắc lại lần nữa được không ta...?
SCENE_MAI_DOGGY_BUNNY_AFTER_02,Hehe... so? How was it? ...Do you like this outfit?,嘿嘿……怎样？这套衣服……喜欢吗？,へへっ……どうだった？…この衣装……気に入った？,헤헤.. 어땠어? 이 의상.. 마음에 들었어?,嘿嘿……怎樣？這套衣服……喜歡嗎？,余韻,Hê hê...... sao nào? Bộ trang phục này...... cậu có thích không?
SCENE_REINA_COWGIRL_PLAYING_01,Auh...! Ugh! ...Nn...,啊呜……！呜呃！ ……嗯……,あぅっ…！うぐっ！…んぅ…,아읏..! 으긋! ..응..,啊嗚……！嗚呃！……嗯……,(子犬のように)驚き,Á...! Ư...! Ưm...
SCENE_REINA_COWGIRL_CUM_01,Ah...! Auh...!,啊……！啊呜……！,あ…！あうっ…！,아..! 아읏!!,啊……！啊嗚……！,絶頂,A...! Á...!
SCENE_REINA_COWGIRL_PLAYING_03,Nnuh...! ...Ahn...!,嗯呜……！ ……啊嗯……！,んうっ…！…あんっ…！,으흣..! 큿..!,嗯嗚……！……啊嗯……！,(子犬のように)驚き,Ưm...! A...!
SCENE_REINA_COWGIRL_CUM_02,Nn...! Hoo... ngh...!,嗯……！呼……嗯……！,んぅ…！ふぅ…っ…！,으응..! 흣..!,嗯……！呼……嗯……！,絶頂,Ưm...! Phù...!
SCENE_REINA_COWGIRL_PLAYING_02,...Hah... hoo... ah...,……哈啊……呼……啊……,っ…はぁっ…くぅん…あっ…,읏.. 하앗.. 끄응.. 앗..,……哈啊……呼……啊……,(子犬のように),Ư... hà... ưm... á...
SCENE_REINA_COWGIRL_PLAYING_04,Nn... hah... haaah... uuh...!,嗯……哈啊……哈啊啊……呜呜……！,んぅ…はぁっ…はぁあ…うぅっ！,응.. 헤엑.. 하아아.. 으읏!,嗯……哈啊……哈啊啊……嗚嗚……！,(子犬のように),Ưm... hà... hà... ư...!
SCENE_BUTLER_HJ_FELLATIO_CUM_01,Ah...! A-are you going to ejaculate? ...Y-yes!,啊……！您、您要射精了吗？ ……是、是的！,あっ…！しゃ、射精なさるのですか？…は…はいっ！,아..! 사.. 사정 하시려는 겁니까? 네.. 네엣!,啊……！您、您要射精了嗎？……是、是的！,びっくり+絶頂,A...! N-ngài sắp xuất tinh sao ạ? ...V-vâng!
SCENE_BUTLER_HJ_FELLATIO_CUM_02,Yes! I-I shall take... all of it...!,是！全、全部……我都会收下的……！,はい！ぜ、全部…いただきますからっ…！,네! 저.. 전부 받아드릴 테니까..!,是！全、全部……我都會收下的……！,びっくり+絶頂,Vâng! Em... em sẽ nhận lấy... hết toàn bộ ạ...!
SCENE_REINA_DOGGY_PLAYING_04,...Nn... uuh! Hah... hah...,……嗯……呜呜！哈啊……哈啊……,…んぅ…ううっ！はぁ…はぅっ！,..으응.. 으읏! 하아.. 하읏!,……嗯……嗚嗚！哈啊……哈啊……,びっくり,...Ưm... ư...! Hà... á...!
SCENE_REINA_BREAST_TOUCH_CUM_01,Haaah... if you touch me like that...! Auh...,哈啊啊……您这样摸我的话……！啊呜……,はああっ…そんなふうに触られたら…！あうっ…,하아앗.. 그렇게 만져지면!.. 아읏..,哈啊啊……您這樣摸我的話……！啊嗚……,びっくり,Hà... bị chạm vào kiểu đó thì...! Á...
SCENE_REINA_BREAST_TOUCH_CUM_02,Nn...! Ah... uuh... hah...,嗯……！啊……呜呜……哈啊……,んっ…！あ…ううっ…はぅっ…,응..! 아.. 으읏.. 하읏..,嗯……！啊……嗚嗚……哈啊……,絶頂,Ưm...! A... ư... á...
SCENE_REINA_DOGGY_PLAYING_02,Hah... hah... you can go even deeper... it's okay...,哈啊……哈啊……再深入一点……也可以……,はぁ…はぁ…もっと深くても、いいですから…,하아.. 하아.. 좀더 깊어도 좋으니까..,哈啊……哈啊……再深入一點……也可以……,びっくり,Hà... hà... đâm sâu hơn nữa cũng được mà anh...
SCENE_REINA_DOGGY_PLAYING_03,Aah...! Ah... hah...,啊啊……！啊……哈啊……,ああん…！あ…はぅっ…,아앙..! 아.. 하읏..,啊啊……！啊……哈啊……,びっくり,A...! A... á...
SCENE_REINA_DOGGY_PLAYING_01,Ah...! Hah...! Nn... you're hitting... so deep...,啊……！哈啊……！嗯……顶到……里面了……,あっ…！はぅっ…！んぅ…奥…突かれてます…,아! 하읏..! 으응.. 안쪽.. 찔러주고 있어요..,啊……！哈啊……！嗯……頂到……裡面了……,びっくり,A...! Á...! Ưm... anh đang đâm... chạm đáy rồi...
SCENE_KONIAL_DEEPTHROAT_READY_01,That stimulating scent... hah... what... is this...,这股刺激的味道……哈啊……这……是什么……,刺激的な匂い…はぁ…なんだ…これは…,엄청 자극적인 냄새.. 하아.. 뭐야 이거..,這股刺激的味道……哈啊……這……是什麼……,うろたえる,Mùi hương thật kích thích... hà... cái gì... thế này...
SCENE_KONIAL_DEEPTHROAT_READY_02,Hah...? I am not aroused at all...,哈啊……？我才没有兴奋……,はぁ…？全然、興奮なんてしてないが…？,하? 전혀 흥분하고 있지 않거든?,哈啊……？我才沒有興奮……,うろたえる,Hả...? Ta hoàn toàn không hề hưng phấn chút nào hết...?
SCENE_KONIAL_DEEPTHROAT_READY_03,Move that filthy cock away already...!,快把那根肮脏的鸡鸡……拿开……！,汚いちんぽを、さっさと…ど…どけろ…っ！,더러운 자지 당장 치우지 모.. 못해?,快把那根骯髒的雞雞……拿開……！,びっくり,Mau tránh cái thứ dơ bẩn đó... r-ra chỗ khác ngay...!
SCENE_REINA_AHEN_KISS_4,...Mm-kiss...,……嗯啾……,…んちゅっ…,츄웁..,……嗯啾……,キス,...*chụt*...
SCENE_REINA_AHEN_FELLATIO_1,Lick...,舔……,ぺろっ…,할짝..,舔……,舐める,Liếm...
SCENE_MAI_ANAL_CUM_02,W-wait a second... I'm not ready... naaah...!,等、等一下……我还没心理准备……嗯啊啊……！,ちょ…ちょっと待って…心の準備がぁ…んああっ…！,자.. 잠깐.. 마음의 준비가.. 아앗..!,等、等一下……我還沒心理準備……嗯啊啊……！,絶頂,Khoan... chờ một chút... tớ chưa chuẩn bị tâm lý mà... á...!
SCENE_MAI_COWGIRL_FIRST_READY_01,Nn... are you still not ready?,嗯……你还没准备好吗？,んっ…まだ準備できてないの？,하아.. 아직 준비 안 됐어?,嗯……你還沒準備好嗎？,期待 / 予感,Ưm... cậu vẫn chưa sẵn sàng sao?
SCENE_MAI_ANAL_CUM_01,You're... coming in my butt...? Ahn...!,你要……射在屁股里……？啊嗯……！,お尻に……出すの…？ あんっ…！,엉덩이에.. 싼다고? 아앙!,你要……射在屁股裡……？啊嗯……！,絶頂,Cậu định bắn... vào lỗ hậu sao...? A...!
SCENE_REINA_AHEN_KISS_1,Nngh...,嗯唔……,んぐぅ…,우웁..,嗯唔……,キス,Ưm...
SCENE_MAI_AHEN_KISS_2,Sluuurp...,啾噜噜……,じゅるるっ…,쥬르릅..,啾嚕嚕……,よだれ,*Chùn chụt*...
SCENE_MAI_COWGIRL_FIRST_READY_03,"I'm already soaking wet, you know...?",我已经湿得一塌糊涂了耶……？,あたし…もう、ぐしょぐしょに濡れてんだけど…？,난 잔뜩 젖었단 말야.. 응?,我已經濕得一塌糊塗了耶……？,期待 / 予感,Tớ... đã ướt sũng hết cả rồi này...?
SCENE_KONIAL_AHEN_KISS_3,Mmm...,啾……,ちゅ…,츄..,啾……,キス,Chụt...
SCENE_MAI_COWGIRL_FIRST_READY_02,"It's fine if you put it in like this, right?",就这样放进来也可以吧？,このまま入れちゃってもいーよね？,이대로 넣어 버려도 되지?,就這樣放進來也可以吧？,期待 / 予感,Cứ thế cho vào luôn nhé?
SCENE_REINA_MISSIONARY_KISS_AFTER_03,...Shall we stay like this... and kiss a little longer...? ...Nn...,……就这样……再接吻一下，好吗……？ ……嗯……,…このまま…もう少しキス、しましょうか…？…んっ…,..이대로.. 좀 더 키스 할까요?.. 하아..,……就這樣……再接吻一下，好嗎……？……嗯……,照れてる,...Cứ thế này... chúng ta hôn nhau thêm một chút nữa nhé...? ...Ưm...
SCENE_REINA_MISSIONARY_KISS_AFTER_02,...I really... am so happy... mmm...,……我真的……好幸福……啾噗……,…本当に…幸せです…ちゅぷ…,..정말.. 행복해요.. 츄읍..,……我真的……好幸福……啾噗……,キス,...Em thực sự... hạnh phúc lắm... *chụt*...
SCENE_REINA_MISSIONARY_KISS_AFTER_01,Hah... hah... my tummy... feels so full...,哈啊……哈啊……肚子里……被填得好满……,はぁ…はぁ…お腹の中…いっぱいです…,하아.. 하아.. 뱃속이.. 가득해요..,哈啊……哈啊……肚子裡……被填得好滿……,余韻,Hà... hà... trong bụng em... ngập tràn rồi...
SCENE_REINA_MISSIONARY_KISS_READY_02,Like this... looking into each other's eyes... mm... kiss...,像这样……彼此对望着……嗯唔……啾……,こうして…見つめ合って…んむ…ちゅ…,이렇게.. 마주보고.. 우음.. 츄..,像這樣……彼此對望著……嗯唔……啾……,照れてる+キス,Cứ thế này... nhìn vào mắt nhau... ưm... *chụt*...
SCENE_REINA_MISSIONARY_KISS_READY_03,Please bring your face... a little closer... hah...,请把脸……再靠近一点……哈啊……,もう少し…顔を近づけてください…はぁ…,좀..더. 얼굴 가까이 해 주세요.. 하아..,請把臉……再靠近一點……哈啊……,照れてる+キス,Kề sát khuôn mặt anh... lại gần em thêm chút nữa đi... hà...
SCENE_REINA_MISSIONARY_KISS_READY_01,Yes... kiss... I love you... nn...,嗯……啾……我爱你……嗯……,はい…ちゅっ…あなたを…愛しています…んぅ…,네.. 츄읍.. 당신을.. 사랑해요.. 으응..,嗯……啾……我愛你……嗯……,照れてる+キス,Vâng... *chụt*... em yêu anh... ưm...
SCENE_KONIAL_FULL_NELSON_PLAYING_01,Ahn...! Haaah...! Wh-what is this feeling...! Hah...!,啊嗯……！哈啊啊……！这、这种感觉……到底是……！哈呜……！,あんっ…！はぁあっ…！こ…この感じ…一体…！はうぅっ…！,아앙..! 아앗..! 이.. 이 느낌.. 뭐야..! 하읏!,啊嗯……！哈啊啊……！這、這種感覺……到底是……！哈嗚……！,びっくり,A...! Hà...! C-cảm giác này... rốt cuộc là sao chứ...! Á...!
SCENE_KONIAL_FULL_NELSON_PLAYING_02,C-could you... be a little gentler... naaah...?!,你、你就不能……温柔一点吗……嗯啊啊……？ ！,も……もっと優しくしないか…んぁあっ……？！,조.. 좀 더 상냥하게엣..?!,你、你就不能……溫柔一點嗎……嗯啊啊……？！,びっくり,Ng-ngươi không thể nhẹ nhàng hơn chút được sao... á...?!
SCENE_KONIAL_FULL_NELSON_PLAYING_03,Kihi... n-no...! It does not... feel good...! Naaah...!,嘻……不、不是……！才不是……舒服……！嗯啊啊……！,きひっ…ち、違うぞ…！気持ち…いいわけ…！んぁあっ…！,키히히.. 아니야..! 기분.. 좋을 리가..! 아앙!,嘻……不、不是……！才不是……舒服……！嗯啊啊……！,びっくり,Khi... kh-không phải đâu...! Ta làm sao có thể... sướng được chứ...! Á...!
