key,en,cn,jp,ko,zh,情緒,vi
SCENE_REINA_SYUYU_READY_03,Hehe... you look cute sucking my breasts...,呵呵……您吸着我胸部的样子……好可爱呢……,ふふっ…私のおっぱいを吸ってる姿…可愛いですね…,후훗.. 제 젖을 빠는 모습.. 귀여워요..,呵呵……您吸著我胸部的樣子……好可愛呢……,笑顔,Hư hư... trông anh lúc bú ngực em... đáng yêu thật đấy...
SCENE_REINA_BREAST_TOUCH_PLAYING_01,Aah...! If you squeeze me that tightly...,啊啊……！您这样……用力抓的话……,ああん…！そんなに…ぎゅっとされたら…,아응..! 그렇게.. 꽉 쥐시면..,啊啊……！您這樣……用力抓的話……,びっくり,A...! Nếu anh bóp... mạnh tay thế...
SCENE_REINA_BREAST_TOUCH_PLAYING_03,Hah... your breath is on my neck... it feels so strange...,哈啊……您的气息碰到我的脖子……感觉变得好奇怪……,はぁ…息が首にあたって…なんだか、おかしくなりそうです…,하아.. 숨결이 목에 닿아서.. 더 이상해요..,哈啊……您的氣息碰到我的脖子……感覺變得好奇怪……,照れてる,Hà... hơi thở anh phả vào cổ em... làm em cứ thấy rạo rực thế nào ấy...
SCENE_REINA_BREAST_TOUCH_PLAYING_02,My nipples... they're hard... Hah... from your fingers touching them...,我的乳头……变硬了……呼……被您的手指这样摸着……,乳首…硬くなっちゃいました…ふぅっ…指で、触られて…,유두.. 딱딱해졌어요.. 흣.. 손가락으로 만져져서..,我的乳頭……變硬了……呼……被您的手指這樣摸著……,照れてる,Đầu ti em... cứng ngắc mất rồi... Phù... bị ngón tay anh xoa lên...
SCENE_REINA_BREAST_TOUCH_PLAYING_04,...Ah... yes... you can be rougher... it won't hurt...,……啊……好的……再用力一点也……不会痛的……,…あっ…はい…もっと…強くしても…痛くない、ですから…,..앗.. 네.. 더.. 세게 하셔도.. 아프지 않으니까요..,……啊……好的……再用力一點也……不會痛的……,照れてる,...Á... vâng... dù anh có làm... mạnh hơn nữa... em cũng không thấy đau đâu...
SCENE_REINA_DOGGY_SWIMSUIT_PLAYING_04,Hah... just... relax for me...,哈呜……请您……放轻松就好……,はぅっ…楽に…していてくださいね…,하읏.. 편하게.. 있으셔도 되요..,哈嗚……請您……放輕鬆就好……,照れてる,Á... anh cứ... tận hưởng đi nhé...
SCENE_PAZUZU_COWGIRL_AFTER_03,"I'll keep wringing you dry, so hurry and get hard again...",我还会继续榨干你，请快点再勃起吧……,まだまだ搾り取りますから、早く勃たせてくださいね…,"잔뜩 해야 하니까, 빨리 세우도록 하세요..",我還會繼續榨乾你，請快點再勃起吧……,真面目,"Ta sẽ còn vắt kiệt ngươi nữa, nên hãy mau làm cho nó cương lên đi..."
SCENE_REINA_DOGGY_SWIMSUIT_PLAYING_02,Hah... it's deep... yours is... all the way inside me...,哈呜……好深……您的……全部都进来了……,はぅっ…深いです…あなたのが…全部、入ってきてます…,하읏.. 깊어요.. 당신의 것.. 전부 들어오고 있어요..,哈嗚……好深……您的……全部都進來了……,照れてる,Á... sâu quá... cái đó của anh... đi vào hết trong em rồi...
SCENE_KONIAL_COWGIRL_PLAYING_04,Hold out until your limit. Try satisfying me...!,忍到极限为止吧。试着让我满足看看……！,限界まで我慢するんだぞ？我を満足させてみろ…！,최대한 참아야 한다? 날 만족시켜 줘야지!,忍到極限為止吧。試著讓我滿足看看……！,おどけて,Hãy ráng nhịn tới giới hạn nhé? Hãy làm cho ta được thỏa mãn xem nào...!
SCENE_PAZUZU_COWGIRL_AFTER_02,"You really do come a lot... hah... look, it's overflowing...",你真的很会射呢……哈啊……都溢出这么多了……,よく出ますね…はぁ…いっぱい…溢れてるじゃないですか…,많이도 나오네요.. 하아.. 넘치고 있잖아요..,你真的很會射呢……哈啊……都溢出這麼多了……,感嘆,Bắn nhiều thật đấy... hà... chẳng phải đã tràn ngập ra ngoài rồi sao...
SCENE_REINA_DOGGY_SWIMSUIT_READY_03,Look at me... as much as you like...,请尽情地……看着我吧……,いくらでも…見てくださいね…,얼마든지.. 봐 주세요..,請盡情地……看著我吧……,照れてる,Anh muốn ngắm bao nhiêu... cũng được hết ạ...
SCENE_REINA_DOGGY_SWIMSUIT_PLAYING_03,"It feels... good, doesn't it? ...Aah...!",很……舒服吧？ ……啊啊……！,気持ち…いいですよね？…ああん…！,기분.. 좋으시죠? ..아앙..!,很……舒服吧？……啊啊……！,照れてる,Anh thấy... sướng đúng không ạ? ...A...!
SCENE_PAZUZU_COWGIRL_AFTER_01,"...You don't think this is the end, do you...?",……你不会以为这样就结束了吧……？,…この程度で終わりだなんて、思ってませんよね…？,..이 정도로 끝난 거라 생각하는 거 아니죠..?,……你不會以為這樣就結束了吧……？,真面目,...Ngươi không nghĩ mới cỡ này đã xong chuyện rồi đúng không...?
SCENE_REINA_DOGGY_SWIMSUIT_READY_02,Only you... get to see me like this. Ahn...,只有您……可以看到喔。啊嗯……,あなただけが…見られるんですよ。あんっ…,당신만.. 볼 수 있는 거에요. 하읏..,只有您……可以看到喔。啊嗯……,照れてる,Chỉ một mình anh... được ngắm em thế này thôi đấy. Ưm...
SCENE_KONIAL_COWGIRL_PLAYING_02,"Kihihi... good... you're reaching quite deep, aren't you?",嘻嘻嘻……很好……挺能顶到深处的嘛？,きひひ…いいぞ…随分と奥まで届くじゃないか…？,키히히.. 좋아.. 꽤나 깊은 곳까지 닿잖아?,嘻嘻嘻……很好……挺能頂到深處的嘛？,からかう,Kê hê hê... tốt đấy... thúc chạm đến tận sâu bên trong rồi cơ à...?
SCENE_REINA_DOGGY_SWIMSUIT_READY_01,Hehe... do you like me dressed like this?,呵呵……您喜欢我这个样子吗？,ふふっ…この姿…気に入りましたか？,후훗.. 이 모습.. 마음에 드세요?,呵呵……您喜歡我這個樣子嗎？,笑顔,Hư hư... dáng vẻ này của em... anh có thích không ạ?
SCENE_REINA_DOGGY_SWIMSUIT_PLAYING_01,Aah...! So good... I can't stop...!,啊啊……！好舒服……停不下来……！,ああん…！いいっ…止められません…！,아앙..! 좋아요.. 멈출수 없어요..!,啊啊……！好舒服……停不下來……！,びっくり,A...! Sướng quá... em không dừng lại được...!
SCENE_KONIAL_COWGIRL_PLAYING_03,Looks like you're packing something useful there...,看来你身上带着挺有用的东西嘛……,なかなか使えるモノを持ってるようだな…？,쓸만한 물건 가지고 있는 걸?,看來你身上帶著挺有用的東西嘛……,からかう,Hóa ra ngươi cũng sở hữu một thứ khá hữu dụng đấy nhỉ...?
SCENE_KONIAL_COWGIRL_PLAYING_01,Ahaa...! Kihihi... Feel every fold... every sensation inside my pussy.,啊哈啊……！嘻嘻嘻……好好感受我阴道里每一层肉壁……每一寸触感。,あはぁ…っ！きひひッ…我の膣のヒダヒダを…感触を…一つ一つ感じてみろ。,아앙..! 키히힛.. 내 질 주름 하나하나 느껴 보라고.,啊哈啊……！嘻嘻嘻……好好感受我陰道裡每一層肉壁……每一寸觸感。,からかう,Á...! Kê hê hê... Hãy cảm nhận từng nếp gấp... từng cảm xúc bên trong âm hộ của ta đi.
SCENE_MAI_PAIZURI_PLAYING_04,Your cock... is getting even bigger between my boobs...,你的肉棒……在我胸部中间变得更大了耶……,あんたのちんぽ…おっぱいの中で、もっとデカくなってんじゃん…,네 자지.. 가슴 안에서 더 커지잖아..,你的肉棒……在我胸部中間變得更大了耶……,びっくり,Con cặc của cậu... kẹp giữa ngực tớ mà lại càng to hơn rồi này...
SCENE_MAI_PAIZURI_PLAYING_02,"Hah, you like having your tip rubbed?",哈啊，你喜欢龟头被摩擦吗？,はぁ、亀頭こすられるの…好き？,"하아, 귀두 비벼지는 거.. 좋아?",哈啊，你喜歡龜頭被摩擦嗎？,照れてる,"Hà, thích được chà sát đầu khấc thế này... đúng không?"
SCENE_MAI_PAIZURI_PLAYING_03,"Hehe... I'll squeeze you tighter between my boobs... like this, nice and firm...",嘿嘿……我用胸部夹得更紧一点……像这样，用力夹住……,へへ…おっぱいの間でもっと締め付けてあげる…こーやって、ぎゅーって…,헤헤.. 가슴 사이로 더 꽉 조여줄게.. 이렇게.. 꾹..,嘿嘿……我用胸部夾得更緊一點……像這樣，用力夾住……,笑顔,"Hê hê... để tớ kẹp chặt hơn nữa vào khe ngực nhé... như thế này này, chặt chưa..."
SCENE_MAI_PAIZURI_PLAYING_01,Nn... slurp... mixing in my drool... making it nice and slick...,嗯……啾噜……混着口水……弄得滑滑的……,ん…ちゅる…よだれ混ぜて…ヌルヌルにしてさ…,으응.. 츄릅.. 침을 섞어서.. 미끌미끌..,嗯……啾嚕……混著口水……弄得滑滑的……,照れてる,Ưm... nhổ thêm nước bọt vào... cho nó trơn tuột ra nhé...
SCENE_MAI_DOGGY_BUNNY_READY_01,You really like... this outfit?,你真的……很喜欢这套衣服吗？,この格好…ほんとに気に入ってんの…？,이 차림이 정말 좋은 거야..?,你真的……很喜歡這套衣服嗎？,照れてる,Bộ trang phục này... cậu thực sự thích nó đến thế cơ à...?
SCENE_MAI_DOGGY_BUNNY_READY_02,"Geez, getting a little too excited there, aren't you?",真是的……你也太兴奋了吧……？,もー…興奮しすぎじゃない…？,정말.. 너무 흥분한 거 아냐?,真是的……你也太興奮了吧……？,照れてる,Trời đất... cậu hưng phấn quá đà rồi đúng không...?
SCENE_MAI_DOGGY_BUNNY_READY_03,Yours... has been pressing against me this whole time. It's gotten so big...,你的……一直顶着我耶。变得好大……,あんたの…ずっと当たってるじゃん。めっちゃデカくなって…,네 거.. 계속 닿고 있잖아. 엄청 커져선..,你的……一直頂著我耶。變得好大……,照れてる,Cái đó của cậu... cứ cọ vào người tớ suốt kìa. To đùng luôn rồi...
SCENE_REINA_COWGIRL_READY_01,Hah... hah...,哈啊……哈啊……,はぁっ…はぁっ…,헥.. 헤엑..,哈啊……哈啊……,(子犬のように),Hà... hà...
SCENE_REINA_COWGIRL_READY_02,Auh... nn... hah...,啊呜……嗯……哈……,あぅっ…んぅ…はっ…,헤읏.. 응.. 핫..,啊嗚……嗯……哈……,(子犬のように),Ư... ưm... á...
SCENE_REINA_COWGIRL_READY_03,Nn... fua...,嗯……呼啊……,んぅ…ふぁっ…,으응.. 헤엑..,嗯……呼啊……,(子犬のように),Ưm... hà...
SCENE_CALL_REINA_MANGOPARTY,Mango Party,Mango Party,Mango Party,Mango Party,Mango Party,待機,Mango Party
SCENE_MAI_STANDING_SEX_READY_02,Me? I'm totally fine.,我？我完全没事啦。,あたし？あたしは全然平気だしー。,나? 난 하나도 힘들지 않은걸.,我？我完全沒事啦。,笑顔,Tớ hả? Tớ hoàn toàn khỏe re mà.
SCENE_MAI_STANDING_SEX_READY_03,"Want me to lower my hips a bit more? Nn, your tip just touched.",要我再把腰放低一点吗？ ……嗯，龟头刚刚碰到了。,もうちょい腰下げてあげよっか？…んっ、亀頭、ちょっと当たったし。,"좀 더 허리 내려 줄까? ..읏, 귀두가 살짝 닿았어.",要我再把腰放低一點嗎？……嗯，龜頭剛剛碰到了。,びっくり,"Tớ hạ thấp hông xuống tí nữa nhé?... Ưm, đầu khấc chạm vào rồi kìa."
SCENE_MAI_STANDING_SEX_READY_01,"Make sure you hold my legs, okay?",要好好扶着我的脚喔？,ちゃんと足、支えててよね…？,다리 잘 잡고 있어야 한다..?,要好好扶著我的腳喔？,照れてる,Phải ôm chắc lấy chân tớ đấy nhé...?
SCENE_MAI_AHEN_KISS_5,Hah... kiss...,哈啊……啾……,はぁ…ちゅっ…,하아.. 쪽..,哈啊……啾……,キス,Hà... chụt...
SCENE_KONIAL_AHEN_KISS_4,*Wet kiss*...,啾噗……,ちゅぷっ…,츄웁..,啾噗……,キス,Chụt...
SCENE_REINA_MISSIONARY_PANTIES_PLAYING_03,Haaah...! Your... sperm... I want it all...!,哈啊啊……！你的……精子……我全部都想要……！,はあぁんっ…！あなたの…精子…っ…全部、欲しいです…！,하앙..! 당신의 씨.. 전부 받고 싶어요..,哈啊啊……！你的……精子……我全部都想要……！,照れてる,Hà...! Tinh dịch của anh... em muốn có... toàn bộ...!
SCENE_REINA_MISSIONARY_PANTIES_PLAYING_02,Nnnh... faster... thrust into me faster... it feels good...!,嗯嗯……再快一点……请更快地插我……好舒服……！,んんっ…もっと…もっと速く…突いてください…気持ちいいです…！,으응.. 더.. 더 빠르게.. 박아주세요.. 좋아요..!,嗯嗯……再快一點……請更快地插我……好舒服……！,照れてる,Ưm... nhanh nữa... đâm nhanh hơn nữa đi anh... sướng quá đi mất...!
SCENE_PAZUZU_AHEN_FELLATIO_1,Nnmm...,嗯唔……,んむっ…,읍..,嗯唔……,キス,Ưm...
SCENE_REINA_MISSIONARY_PANTIES_PLAYING_01,Aah...! Hah... Aahn...! It's coming... all the way in...!,啊啊……！哈……啊嗯……！一直……进到最里面了……！,ああんっ…！…はっ…ぁんっ…！奥まで…入ってきましたぁ…！,아앙! 하읏..! 깊숙이.. 들어왔어요..!,啊啊……！哈……啊嗯……！一直……進到最裡面了……！,びっくり,A...! Á...! Vào tận cùng sâu thẳm... trong em rồi...!
SCENE_MAI_AHEN_KISS_3,Mmm...,啾……,ちゅ…,츄..,啾……,キス,Chụt...
SCENE_REINA_AHEN_KISS_2,Sluuurp...,啾噜噜……,ちゅるるっ…,츄르릅..,啾嚕嚕……,キス,Chùn chụt...
SCENE_REINA_MISSIONARY_PANTIES_PLAYING_04,I-I'm... also... So close to cumming... Ahhn...!,我、我也……快去了……啊啊……！,わ、私も…もうすぐ…イきそうですから…ああんっ…！,저.. 저도.. 곧.. 갈 것 같으니까.. 아앙!,我、我也……快去了……啊啊……！,照れてる,E-em... cũng... sắp ra rồi... a...!
SCENE_MAI_COWGIRL_FIRST_AFTER_01,Hah... hah... wow... my belly's so hot...,哈啊……哈啊……好猛……肚子里好烫喔……,はぁ…はぁ…すご…お腹ん中…熱いよぉ…,하아.. 하아.. 대단해.. 뱃속이.. 뜨거워..,哈啊……哈啊……好猛……肚子裡好燙喔……,余韻,Hà... hà... đỉnh quá... trong bụng tớ... nóng ran lên rồi...
SCENE_KONIAL_PRESS_READY_01,Kuh...! Heavy...! You... hurry up and...!,呿……！好重……！你这家伙……快点……！,くっ…！重い…！このっ…さっさと…！,큿..! 무거워..! 어서 비키지 못해?,呿……！好重……！你這傢伙……快點……！,ツンデレ,Ưm...! Nặng thế...! Ngươi... mau tránh ra...!
SCENE_MAI_COWGIRL_FIRST_AFTER_02,Geez... you came this much? Ahaha...!,真是的……竟然射这么多……啊哈……！,もー…こんなにいっぱい出すなんてさ…あはっ…！,정말.. 이렇게 가득 싸 버리다니.. 아읏.!,真是的……竟然射這麼多……啊哈……！,余韻,Trời ạ... sao lại bắn nhiều đến thế chứ... a ha...!
SCENE_MAI_COWGIRL_FIRST_AFTER_03,"Your face is crazy. Was it that good? Hehe, it was seriously good for me too.",你表情超夸张耶。有那么爽吗？嘿嘿，我也真的超爽。,顔ヤバいじゃん、そんなに良かった？…へへ、あたしはマジで良かったよ。,"표정 좀 봐, 그렇게 좋았어?.. 하핫, 난 무척 좋았어.",你表情超誇張耶。有那麼爽嗎？嘿嘿，我也真的超爽。,余韻+笑顔,"Xem cái mặt cậu kìa, sướng đến thế cơ à?... Hê hê, tớ thì sướng dã man luôn."
SCENE_KONIAL_PRESS_READY_03,What's pressing against me down there...?! No way...!,下面顶着我的是……！难道……！,下に当たってるのって…！まさか…！,아래 닿고 있는 건 뭐야..! 설마..,下面頂著我的是……！難道……！,ツンデレ,Thứ cọ ngay bên dưới là...! Không lẽ nào...!
SCENE_REINA_SITTING_REVERSE_AFTER_01,"Nnnh... hah, hah...",嗯嗯……哈啊、哈啊……,うぅん…っ、はぁ、はぁ…,"우으응.. 읏, 하아아, 하아..",嗯嗯……哈啊、哈啊……,余韻,Ư... hà... hà...
SCENE_KONIAL_PRESS_READY_02,Hah... hah... this doesn't... feel good at all...! Nnuh...!,哈啊……哈啊……我才……一点都不舒服……！嗯呜……！,はぁ…はぁ…全然…気持ちよくなどないぞ…！んぅっ…！,하아.. 하아.. 전혀.. 기분 좋지 않으니까..! 으읏..,哈啊……哈啊……我才……一點都不舒服……！嗯嗚……！,ツンデレ,Hà... hà... ta hoàn toàn... không thấy sướng đâu nhé...! Ư...!
SCENE_KONIAL_AHEN_10,Kuh...,呵呼……,くふっ…,크흣..,呵呼……,喘ぎ,Ưm...
SCENE_REINA_SITTING_REVERSE_AFTER_03,Hah... nnn... my belly is swelling with your semen...,哈啊……嗯嗯……我的肚子……被您的精液撑起来了……,はぁ…んんっ……あなたの精液で、お腹が膨らんでます……,"하으응.. 당신의 정액으로, 배가 볼록해졌어요..",哈啊……嗯嗯……我的肚子……被您的精液撐起來了……,余韻,Hà... ưm...... bụng em căng tròn vì chứa đầy tinh dịch của anh rồi......
SCENE_REINA_SITTING_REVERSE_AFTER_02,"I love you, I love you so much. I can do this as many times as you want...",喜欢你，最喜欢你了。不管几次我都可以……,好き、大好きです。何回だって、できますから…,"좋아, 너무 좋아해요. 몇 번이고 할 수 있어.",喜歡你，最喜歡你了。不管幾次我都可以……,余韻,"Em yêu anh, yêu anh nhiều lắm. Bao nhiêu lần em cũng chiều được tuốt..."
SCENE_REINA_DOGGY_AFTER_02,...I can't believe... I felt that much...,……我竟然……舒服成这样……,…こんなに…感じちゃいました…,..이렇게나.. 느껴버렸어요..,……我竟然……舒服成這樣……,余韻,...Em đã... sướng đến mức này cơ đấy...
SCENE_REINA_DOGGY_AFTER_03,Uuh... ha... hah...,呜呜……哈……哈啊……,ううっ…は…はぁ…,으읏.. 하.. 하아..,嗚嗚……哈……哈啊……,余韻,Ư... hà... hà...
SCENE_REINA_DOGGY_AFTER_01,Hah... hah... that felt... wonderful...,哈啊……哈啊……感觉……好棒……,はぁ……はぁ……すごくよかったです……,"하아.. 하아.. 무척, 좋았어요..",哈啊……哈啊……感覺……好棒……,余韻,Hà...... hà...... sướng lắm anh ơi......
SCENE_REINA_SITTING_REVERSE_PLAYING_04,"Haaahn...! ...Ahuh...! Cock, cock... I love your cock...!",哈啊啊……！ ……啊呼……！肉棒、肉棒……我最喜欢肉棒了……！,はぁあん！……あふぅっ…！おちんちん、おちんちん…大好きぃっ！,"아아앙! ..아흐읏! 자지, 자지 너무 좋하앗!",哈啊啊……！……啊呼……！肉棒、肉棒……我最喜歡肉棒了……！,びっくり,A...! ...Ư...! Em yêu... yêu con cặc của anh nhất...!
SCENE_REINA_SITTING_REVERSE_PLAYING_01,"Ah, nn! There, that feels good...! Uuh!?",啊、嗯！那里，那里好舒服……！呜呜！ ？,あっ、んっ！そこ、そこイイです…！ううっ！？,"아흣! 거기, 거기 좋아요! 으으읏?!",啊、嗯！那裡，那裡好舒服……！嗚嗚！？,びっくり,"A, ưm! Chỗ đó, chỗ đó sướng lắm...! Ôi?!"
SCENE_REINA_SITTING_REVERSE_PLAYING_03,Nnnh...! From now on... you can use my pussy... as much as you want...!,嗯嗯……！从今以后……我的小穴……你想怎么用都可以……！,うぅん……！私のおまんこ…これからずっと…好きなだけ、使っていいですからぁっ…！,"으응..! 평생 내 보지, 얼마든지 써도 되니까앗.",嗯嗯……！從今以後……我的小穴……你想怎麼用都可以……！,びっくり,Ưm......! Từ nay về sau... chỗ này của em... anh muốn xài bao nhiêu tùy thích nhé...!
SCENE_REINA_SITTING_REVERSE_PLAYING_02,I'm always thinking about this cock...! I'm sorry...! Aaah...!,我总是只想着这根……！对不起……！啊啊……！,いつも、このおちんちんのことばかり考えて…！ごめんなさいぃっ…！ああんっ…！,"항상, 이 자지 생각뿐이라..! 죄송해요옷..! 아앙!",我總是只想著這根……！對不起……！啊啊……！,びっくり,Lúc nào đầu óc em cũng chỉ nghĩ về nó thôi...! Em xin lỗi anh...! A...!
SCENE_MAI_COWGIRL_FIRST_PLAYING_01,Aah...! Hah...! Like this... I'll make you feel even better...!,啊啊……！哈呜……！像这样……让你更舒服……！,ああん…！はうっ…！こーやって…もっと気持ちよくしてあげる…！,아앙..! 하읏! 이렇게.. 더 기분 좋게 해줄게..!,啊啊……！哈嗚……！像這樣……讓你更舒服……！,びっくり,A...! Á...! Để tớ làm như thế này... cho cậu sướng hơn nữa nhé...!
SCENE_MAI_COWGIRL_FIRST_PLAYING_02,Good... so good...! Your cock... is hitting my womb...!,好棒……真的好爽……！你的那根……顶到子宫了……！,いい…すっごいいいよぉ…！あんたのちんぽ…子宮まで…突いてるぅ…！,좋아.. 너무 좋아..! 네 자지가.. 자궁을 찌르고 있어..!,好棒……真的好爽……！你的那根……頂到子宮了……！,照れてる,Sướng... sướng quá đi mất...! Con cặc của cậu... đang đâm chạm tử cung tớ rồi...!
SCENE_KONIAL_COWGIRL_READY_03,Watch closely as it spreads my pussy open... and slides inside...,给我仔细看着它撑开我的小穴……插进来的样子……,我のおまんこを押し広げて…入ってくるところ…じっくり見ておけよ？,내 보지를 헤집고 들어가는 거.. 자세히 봐야 한다?,給我仔細看著它撐開我的小穴……插進來的樣子……,からかう,Hãy nhìn cho kỹ cảnh nó đang nong rộng chỗ đó của ta... rồi đút vào trong đi nhé?
SCENE_MAI_COWGIRL_FIRST_PLAYING_03,Hehe... my boobs are bouncing like crazy... you seeing this? Auhn...!,嘿嘿……我的胸部晃得超厉害……你有好好看着吗？啊嗯……！,へへ…あたしのおっぱい…すっごい揺れてんの…ちゃんと見えてる…？あうんっ…！,헤헤.. 내 가슴.. 엄청 흔들리는 거 보여..? 아응..!,嘿嘿……我的胸部晃得超厲害……你有好好看著嗎？啊嗯……！,照れてる,Hê hê... cậu có nhìn rõ... ngực tớ đang nảy tưng bừng lên không...? Á...!
SCENE_MAI_STANDING_SEX_PLAYING_03,This is more embarrassing than I thought... ah... aah...!,比想像中还害羞耶……这个……啊啊……！,思ったより恥ずかしーじゃん…？これぇ…っ…ああん…っ！,생각보다 더 부끄럽네 이거.. 아앙!,比想像中還害羞耶……這個……啊啊……！,照れてる,Làm kiểu này ngại hơn tớ tưởng đấy chứ...? Ôi...... á...!
SCENE_KONIAL_COWGIRL_READY_02,Well? I can tell your cock is already getting hot.,如何？我都感觉到你的那根变烫了喔？,どうだ？もうちんぽが熱くなってるの、我にもわかるぞ？,어때? 벌써부터 자지에서 뜨거운 기운이 느껴지는데.,如何？我都感覺到你的那根變燙了喔？,からかう,Sao hả? Ta cũng cảm nhận rõ con cặc của ngươi đang nóng ran lên rồi đấy?
SCENE_MAI_COWGIRL_FIRST_PLAYING_04,This feels better than I thought... ahh...!,比想像中还舒服耶……啊啊……！,思ったより気持ちいーじゃん…これぇっ…！,생각보다 더 기분 좋잖아 이거엇..,比想像中還舒服耶……啊啊……！,照れてる,Làm kiểu này sướng hơn tớ nghĩ nhiều luôn ấy...!
SCENE_MAI_STANDING_SEX_PLAYING_02,Hah... rub that spot more with your tip... hah!,哈啊……用龟头……再磨那里……哈呜！,はぁっ…亀頭で…そこ、もっとグリグリしてぇ…はぅっ！,좋아.. 귀두로 그쪽 더 긁어 줘.. 하읏!,哈啊……用龜頭……再磨那裡……哈嗚！,びっくり,Hà... dùng đầu khấc... cạ mạnh chỗ đó nữa đi cậu... á!
SCENE_KONIAL_COWGIRL_READY_01,Kihihi... watch closely.,嘻嘻嘻……给我看仔细了。,きひひ……よく見ておくんだな。,키히히.. 잘 보고 있으렴.,嘻嘻嘻……給我看仔細了。,からかう,Kê hê hê...... mở to mắt ra mà ngắm cho kỹ.
SCENE_MAI_STANDING_SEX_PLAYING_01,Aah...! Hah...! It's reaching the entrance to my womb...! This is so good...!,啊啊……！哈啊……！顶到子宫口了……！这个好爽……！,ああん…！はぁ…っ…！子宮の入り口まで…届いてるぅ…！これ、いぃっ…！,아앙..! 하읏! 자궁 입구까지.. 닿고 있어..! 좋아..!,啊啊……！哈啊……！頂到子宮口了……！這個好爽……！,びっくり,A...! Hà...! Thúc chạm tới tận cổ tử cung tớ rồi...! Phê quá đi mất...!
